date,heading,text,SourceTag,Text NER,Heading NER,Text Sentiment,Heading Sentiment
"December 21, 2023 01:05 PM IST","Coal mine cart runs off the tracks in northeastern China, killing 12 workers","Coal mine accident in China's Heilongjiang province claims 12 lives, with 13 injured as an underground mining cart derails, according to state broadcaster CCTV.",world_news3,"['Coal', 'China', 'Heilongjiang', '12', '13', 'CCTV']","['Coal', 'China', '12']","{'positive': 0.04893874749541283, 'negative': 0.31845951080322266, 'neutral': 0.6326017379760742}","{'positive': 0.06342162936925888, 'negative': 0.24744316935539246, 'neutral': 0.6891351938247681}"
"December 21, 2023 11:28 AM IST",Anthropic seeking to raise $750 million in funding round led by Menlo Ventures,Anthropic has shown efforts to secure the resources and deep-pocketed backers needed to compete with OpenAI and be leaders in the technology sector.,world_news3,['OpenAI'],"['$750 million', 'Menlo Ventures']","{'positive': 0.7706558108329773, 'negative': 0.12144993990659714, 'neutral': 0.1078941598534584}","{'positive': 0.3020625412464142, 'negative': 0.28015241026878357, 'neutral': 0.41778498888015747}"
"December 21, 2023 09:27 AM IST","Short Call | Consolidation or correction, Embassy REIT, Glenmark Pharma, Ashok Leyland in focus","Oil prices have seen an uptick since the Red Sea crisis, and a new variant of COVID-19 has reared its ugly head. Consolidation or corrections remains to be seen.",world_news3,"['Red Sea', 'COVID-19']","['Embassy REIT', 'Glenmark Pharma', 'Ashok Leyland']","{'positive': 0.002499618101865053, 'negative': 0.957002580165863, 'neutral': 0.0404977947473526}","{'positive': 0.08449388295412064, 'negative': 0.26288774609565735, 'neutral': 0.652618408203125}"
"December 21, 2023 09:20 AM IST",North Korea's Kim again threatens use of nukes as he praises troops for long-range missile launch,"Since adopting an escalatory nuclear doctrine last year, Kim has repeatedly threatened to use nuclear weapons preemptively.",world_news3,"['last year', 'Kim']","[""North Korea's"", 'Kim']","{'positive': 0.027963602915406227, 'negative': 0.947374701499939, 'neutral': 0.024661734700202942}","{'positive': 0.5306945443153381, 'negative': 0.34724605083465576, 'neutral': 0.12205936759710312}"
"December 21, 2023 09:08 AM IST",Rice prices scale fresh 15-year high as supply risks linger,Prices most recently rallied to that milestone in early August in the wake of sweeping export curbs from top shipper India and as dry weather threatened the Thai crop.,world_news3,"['early August', 'India', 'Thai']",['15-year'],"{'positive': 0.8592345118522644, 'negative': 0.13728466629981995, 'neutral': 0.003480787854641676}","{'positive': 0.5094990134239197, 'negative': 0.4358345866203308, 'neutral': 0.054666344076395035}"
"December 21, 2023 09:14 AM IST",World Street | India's onion export ban; Rate cut bets; Uncle Scrooge; Citi's cleanup; SEC's Bitcoin banter; and more,"From India's onion export ban impacting Asian buyers to British inflation prompts rate cut bets, here's a look at some of the developments from the world of business and economy.",world_news3,"['India', 'Asian', 'British']","['World Street', 'India', 'Rate', 'Uncle Scrooge', 'Citi', 'SEC', 'Bitcoin']","{'positive': 0.010526405647397041, 'negative': 0.9219172596931458, 'neutral': 0.06755634397268295}","{'positive': 0.008322373032569885, 'negative': 0.9908998012542725, 'neutral': 0.0007778506260365248}"
"December 21, 2023 09:08 AM IST",Geopolitics: Turbulence & uncertainty of 2023 will spill over into 2024,"The world’s fatigue with wars isn’t bringing an end to the Ukraine or Gaza war.  As 2023 winds its way to an end, much rests on global economic recovery and growth in 2024, the outcome of the US presidential elections, and the next stage of AI progress after the rapid strides of generative AI this year",world_news3,"['Ukraine', 'Gaza', '2023', '2024', 'US', 'AI', 'AI', 'this year']","['Geopolitics: Turbulence &', '2023', '2024']","{'positive': 0.013693842105567455, 'negative': 0.98624587059021, 'neutral': 6.028488860465586e-05}","{'positive': 0.020742809399962425, 'negative': 0.9149988889694214, 'neutral': 0.06425829976797104}"
"December 21, 2023 08:15 AM IST","Bangladesh: As elections draw close, India needs to rethink its strategies",Holding a free and fair election was never a virtue of India’s eastern neighbour. But elections had never been as consistently farcical either. It would be of keen interest to know how the prevailing scenario in Dhaka had been helping and would help the Indian cause,world_news3,"['India', 'Dhaka', 'Indian']",['India'],"{'positive': 0.9999692440032959, 'negative': 3.0729788704775274e-05, 'neutral': 2.1274502159940312e-08}","{'positive': 0.19402924180030823, 'negative': 0.5639180541038513, 'neutral': 0.24205271899700165}"
"December 21, 2023 07:58 AM IST",Asia stocks fall as Wall Street rally stalls,"The equities rally, which had been driven by falling interest rates and the Federal Reserve’s dovish turn, stalled on Thursday even after U.S. economic data that beat expectations initially turned the major indexes green.",world_news3,"['the Federal Reserve’s', 'Thursday', 'U.S.']",['Asia'],"{'positive': 0.8890514969825745, 'negative': 0.10579667240381241, 'neutral': 0.005151879042387009}","{'positive': 0.2634190618991852, 'negative': 0.16843658685684204, 'neutral': 0.5681443810462952}"
"December 21, 2023 07:55 AM IST",First protests in Argentina as groups react to Milei austerity plan,"Thousands gathered in Buenos Aires on Wednesday to demonstrate against the government's economic shock measures, marking a significant challenge for Argentina's newly-elected libertarian president, Javier Milei. The protest signals the first major test for his administration amid public discontent.",world_news3,"['Thousands', 'Buenos Aires', 'Wednesday', 'Argentina', 'Javier Milei', 'first']","['First', 'Argentina', 'Milei']","{'positive': 0.4766530692577362, 'negative': 0.4062291085720062, 'neutral': 0.11711782217025757}","{'positive': 0.28128165006637573, 'negative': 0.08250302076339722, 'neutral': 0.6362152695655823}"
"December 23, 2023 04:16 PM IST",Entrepreneurship development centres to come up in over 100 govt institutes in NE,"The project is aimed at creating a pool of 107 trained mentors who shall operate from the ITIs and NSTIs and act as 'change agents' to drive the entrepreneurial movement among the youth, the release said.",stock_news1,['107'],"['over 100', 'NE']","{'positive': 0.8446827530860901, 'negative': 0.08918698877096176, 'neutral': 0.06613016128540039}","{'positive': 0.10122853517532349, 'negative': 0.717536211013794, 'neutral': 0.18123528361320496}"
"December 23, 2023 12:55 PM IST",Moneycontrol Selects: Top stories this afternoon,Our specially curated package of the most interesting articles to help you stay at the top of your game.,stock_news1,[],['this afternoon'],"{'positive': 0.9994004964828491, 'negative': 0.00012906907068099827, 'neutral': 0.00047047296538949013}","{'positive': 0.6561357378959656, 'negative': 0.2390354871749878, 'neutral': 0.10482878237962723}"
"December 23, 2023 10:07 AM IST",Small-cap index hits fresh record high; 46 stocks gain 10-60%,"The caution is advised as certain sectors appear to be in overbought territory potentially setting the stage for profit-booking. This could notably impact mid and small-cap equities, says Om Mehra, Technical Analyst, SAMCO Securities.",stock_news1,"['Mehra', 'Technical Analyst', 'SAMCO Securities']","['46', '10-60%']","{'positive': 0.9995760321617126, 'negative': 0.00025296906824223697, 'neutral': 0.00017095910152420402}","{'positive': 0.9467482566833496, 'negative': 0.02264605648815632, 'neutral': 0.030605724081397057}"
"December 23, 2023 09:16 AM IST",Market snaps seven-week rally; PSU Banks worst hit,"Foreign institutional investors (FIIs) turned net sellers in this week, as they sold equities worth of Rs 6,422.24 crore, while Domestic institutional investors (DIIs) bought equities worth Rs 9,093.99 crore",stock_news1,"['this week', 'Rs 6,422.24', 'Rs 9,093.99']","['seven-week', 'PSU Banks']","{'positive': 0.9999951124191284, 'negative': 2.5994279440055834e-06, 'neutral': 2.2058620743337087e-06}","{'positive': 0.026261022314429283, 'negative': 0.9531095623970032, 'neutral': 0.02062947116792202}"
"December 23, 2023 09:41 AM IST",S&P 500 ends higher ahead of long holiday weekend,"The Dow Jones Industrial Average fell 18.38 points, or 0.05%, to 37,385.97, the S&P 500 gained 7.88 points, or 0.17%, at 4,754.63 and the Nasdaq Composite added 29.11 points, or 0.19%, at 14,992.97.",stock_news1,"['18.38', '0.05%', '37,385.97', '7.88', '0.17%', '4,754.63', 'the Nasdaq Composite', '29.11', '0.19%']",[],"{'positive': 0.3920026123523712, 'negative': 0.4581804573535919, 'neutral': 0.14981694519519806}","{'positive': 0.7329860925674438, 'negative': 0.052474092692136765, 'neutral': 0.2145397812128067}"
"December 23, 2023 08:32 AM IST",OpenAI in talks to raise new funding at $100 billion valuation,"OpenAI is reportedly in preliminary discussions to secure a new funding round at a valuation of $100 billion or more, according to sources cited by Bloomberg News on Friday.",stock_news1,"['OpenAI', '$100 billion', 'Bloomberg News', 'Friday']","['OpenAI', '$100 billion']","{'positive': 0.315125435590744, 'negative': 0.16464155912399292, 'neutral': 0.5202329754829407}","{'positive': 0.127254918217659, 'negative': 0.19424785673618317, 'neutral': 0.6784972548484802}"
"December 23, 2023 08:26 AM IST","Stocks edge up, dollar eases before long holiday weekend","Global stock indexes mostly climbed, and the U.S. dollar fell to a near five-month low on Friday before the long holiday weekend. Cooler-than-expected U.S. inflation data reinforced the belief that the Federal Reserve might cut borrowing costs in the new year.",stock_news1,"['U.S.', 'five-month', 'Friday', 'the long holiday weekend', 'U.S.', 'the Federal Reserve', 'the new year']",['before long holiday'],"{'positive': 0.3976832628250122, 'negative': 0.5991263389587402, 'neutral': 0.003190387738868594}","{'positive': 0.4883217215538025, 'negative': 0.02028469182550907, 'neutral': 0.4913935661315918}"
"December 23, 2023 08:36 AM IST",Gold gains as rising Fed rate cut bets boost appeal,"Gold reaches a two-week high on Friday, marking a second consecutive weekly rise, as the dollar and U.S. Treasury yields decline amid growing expectations of an early interest rate cut by the Federal Reserve.",stock_news1,"['two-week', 'Friday', 'second', 'weekly', 'U.S. Treasury', 'the Federal Reserve']",['Fed'],"{'positive': 0.9865027666091919, 'negative': 0.0060223788022994995, 'neutral': 0.007474753074347973}","{'positive': 0.589645266532898, 'negative': 0.4089643061161041, 'neutral': 0.0013904173392802477}"
"December 23, 2023 08:19 AM IST",Moneycontrol Pro Weekender: A Modern Christmas Carol,"Jay Powell meets the ghosts of markets past,  present and future",stock_news1,['Jay Powell'],['Moneycontrol Pro Weekender'],"{'positive': 0.17498824000358582, 'negative': 0.23835140466690063, 'neutral': 0.5866603255271912}","{'positive': 0.6702719926834106, 'negative': 0.06688588112592697, 'neutral': 0.2628421485424042}"
"December 23, 2023 09:42 AM IST",Daily Voice | This expert plans to diversify his Rs 10-lakh-investment among these 11 smallcap stocks,"Unexpected election results will have a major impact on markets. The budget announcement in February will be the next major event, says Divam Sharma.",stock_news1,"['February', 'Divam Sharma']","['Daily Voice', 'Rs 10-lakh', '11']","{'positive': 0.6973519325256348, 'negative': 0.1445942372083664, 'neutral': 0.15805383026599884}","{'positive': 0.41564425826072693, 'negative': 0.32555654644966125, 'neutral': 0.25879913568496704}"
"December 23, 2023 07:47 AM IST",Safeguard against wind swings at the top with Collar: Shubham Agarwal,An quick explainer on why one should perfect Collar strategy against the wild swings.,stock_news1,['Collar'],['Shubham Agarwal'],"{'positive': 0.8976505398750305, 'negative': 0.013123170472681522, 'neutral': 0.08922623842954636}","{'positive': 0.41669896245002747, 'negative': 0.13919951021671295, 'neutral': 0.44410157203674316}"
"December 23, 2023 01:47 AM IST",Gretex Share Broking files IPO papers with SEBI to raise funds,Gretex Share Broking IPO | The IPO is a combination of fresh issue of 1.67 crore equity shares and an offer-for-sale (OFS) of 30.96 lakh shares by selling shareholders.,stock_news1,"['IPO', 'IPO', '1.67', 'OFS', '30.96']",['IPO'],"{'positive': 0.9960014224052429, 'negative': 0.003998124971985817, 'neutral': 5.103525495542272e-07}","{'positive': 0.35162824392318726, 'negative': 0.29889991879463196, 'neutral': 0.34947189688682556}"
"December 22, 2023 09:33 PM IST",US stocks trade higher on cooler inflation data,"Around 15 minutes into trading, the Dow Jones Industrial Average was up 0.2 percent at 37,475.67.",stock_news1,"['Around 15 minutes', '0.2 percent', '37,475.67']",['US'],"{'positive': 0.028747783973813057, 'negative': 0.5871540307998657, 'neutral': 0.3840981423854828}","{'positive': 0.13876290619373322, 'negative': 0.06197555735707283, 'neutral': 0.7992615699768066}"
"December 22, 2023 09:48 PM IST",Gold gains 1% as rising Fed rate cut bets boost appeal,"Spot gold was up 1.2% to $2,069.34 per ounce as of 9:43 a.m. ET (1443 GMT), its highest since Dec. 4, putting it on course for a 1.8% weekly gain.",stock_news1,"['1.2%', '2,069.34', '9:43 a.m.', 'ET', '1443', 'GMT', 'Dec. 4', '1.8%', 'weekly']","['1%', 'Fed']","{'positive': 0.3255675733089447, 'negative': 0.021249378100037575, 'neutral': 0.6531830430030823}","{'positive': 0.6892348527908325, 'negative': 0.30971917510032654, 'neutral': 0.0010459719924256206}"
"December 22, 2023 08:53 PM IST",Oil prices set for weekly gain as Red Sea tension persists,"Brent crude futures were up 92 cents, or 1.2%, to $80.31 a barrel at 1445 GMT.",stock_news1,"['92 cents', '1.2%', '80.31', 'GMT']","['weekly', 'Red Sea']","{'positive': 0.0014551746426150203, 'negative': 0.9976060390472412, 'neutral': 0.0009387862519361079}","{'positive': 0.10760819911956787, 'negative': 0.13729123771190643, 'neutral': 0.7551006078720093}"
"December 22, 2023 06:59 PM IST","Mirae Asset aims to be among top 5 brokers in 5 years, with Sharekhan acquisition","On December 12, Mirae Asset acquired retail broking firm Sharekhan from BNP Paribas for Rs 3,000 crore, marking a shakeup in the industry. As of November end, Mirae Asset had 2.42 lakh NSE active clients while Sharekhan had 6.24 lakh active clients",stock_news1,"['December 12', 'Mirae Asset', 'Sharekhan', 'BNP Paribas', 'Rs 3,000', 'November end', 'Mirae Asset', '2.42', 'NSE', 'Sharekhan', '6.24']","['5', '5 years', 'Sharekhan']","{'positive': 0.9888716340065002, 'negative': 0.008352397941052914, 'neutral': 0.0027760034427046776}","{'positive': 0.880311131477356, 'negative': 0.04946305975317955, 'neutral': 0.07022587954998016}"
"December 22, 2023 06:57 PM IST",UPL to raise Rs 4200 crore via rights issue,The company said it will announce record date for the issue at a later date.,stock_news1,[],['Rs 4200'],"{'positive': 0.6364951133728027, 'negative': 0.14351892471313477, 'neutral': 0.2199859321117401}","{'positive': 0.3279033303260803, 'negative': 0.05000702664256096, 'neutral': 0.622089684009552}"
"December 22, 2023 06:06 PM IST",India's forex reserves jump $9.112 bn to $615.971 bn,"In the previous reporting week, the overall reserves had risen USD 2.816 billion to USD 606.859 billion.",stock_news1,"['the previous reporting week', 'USD 2.816 billion']","['India', '9.112', '615.971']","{'positive': 0.1098177507519722, 'negative': 0.7625539898872375, 'neutral': 0.12762826681137085}","{'positive': 0.0109229302033782, 'negative': 0.002404330298304558, 'neutral': 0.9866727590560913}"
"December 22, 2023 05:58 PM IST","Business in the Week Ahead (December 25-29, 2023)","Santa is here, so is the festive cheer. Even the new year is knocking on the door. What are the early signs to look out for on the investment landscape? India’s fiscal deficit and CAD, a central bank summary of opinions, macro numbers and a clutch of IPOs will be the key talking points in the truncated next week",stock_news1,"['Santa', 'the new year', 'India', 'CAD', 'next week']","['the Week Ahead', 'December 25-29']","{'positive': 0.7366868853569031, 'negative': 0.04180823639035225, 'neutral': 0.22150486707687378}","{'positive': 0.35655373334884644, 'negative': 0.0448908768594265, 'neutral': 0.5985553860664368}"
"December 22, 2023 06:27 PM IST","The Reading List: December 22, 2023","A selection of articles and social media gems from the world of economy, business and finance, curated by our research and opinion teams",stock_news1,[],"['December 22, 2023']","{'positive': 0.31926199793815613, 'negative': 0.24411728978157043, 'neutral': 0.4366207718849182}","{'positive': 0.02832205221056938, 'negative': 0.03756745159626007, 'neutral': 0.9341104626655579}"
"December 22, 2023 05:27 PM IST","SME IPOs saw unprecedented retail interest in 2023, 51 oversubscribed by more than 100x: FYERS report",The brokerage's report on IPOs performance in 2023 also said that a few of these SME IPOs delivered better returns months after listing,stock_news1,"['2023', 'SME', 'months']","['SME', '2023', '51']","{'positive': 0.32416635751724243, 'negative': 0.623655378818512, 'neutral': 0.05217824876308441}","{'positive': 0.5535959005355835, 'negative': 0.34547901153564453, 'neutral': 0.10092510282993317}"
"December 22, 2023 07:12 PM IST","Technical View | Recovery indicates Nifty may march towards 21,600 again, though snaps 7-week rally","The Options data indicated that 21,500 is expected to be near term resistance for the Nifty 50, with support at 21,200-21,000 levels",stock_news1,"['Options', '21,500', '21,200-21,000']","['Technical View', '21,600', '7-week']","{'positive': 0.869055449962616, 'negative': 0.044153545051813126, 'neutral': 0.0867910087108612}","{'positive': 0.311487078666687, 'negative': 0.16424939036369324, 'neutral': 0.5242635607719421}"
"December 22, 2023 04:52 PM IST",UK recession might be under way after economy shrinks in Q3,"Gross domestic product (GDP) contracted by 0.1% in the third quarter, the Office for National Statistics (ONS) said.",stock_news1,"['0.1%', 'the third quarter', 'the Office for National Statistics (ONS']","['UK', 'Q3']","{'positive': 0.8181084394454956, 'negative': 0.005260741338133812, 'neutral': 0.17663083970546722}","{'positive': 0.04681197553873062, 'negative': 0.8056464791297913, 'neutral': 0.14754153788089752}"
"December 22, 2023 04:46 PM IST",Gainers & Losers: 10 stocks that moved the most on December 22,"About 2163 shares advanced, 1457 shares declined, and 114 shares remained unchanged on December 22.",stock_news1,"['About 2163', '1457', '114', 'December 22']","['Gainers & Losers', '10', 'December 22']","{'positive': 0.9785111546516418, 'negative': 0.008190914988517761, 'neutral': 0.013297948986291885}","{'positive': 0.15773066878318787, 'negative': 0.1879042387008667, 'neutral': 0.654365062713623}"
"December 22, 2023 04:30 PM IST","Live: Nifty at 21,350 l Sensex up 242 pts l IT, pharma, metal, realty gain l Bajar Gupshup",BSE midcap index rose 0.7% and smallcap index rose 1%. Top gainer for today was Wipro whereas the top loser was Grasim. For more analysis on today's market highs tune into Bajar Gupshup with Sumit Mehrotra only on Moneycontrol.,stock_news1,"['BSE', '0.7%', '1%', 'today', 'Wipro', 'Grasim', 'today', 'Bajar Gupshup', 'Sumit Mehrotra', 'Moneycontrol']","['21,350', '242', 'Bajar']","{'positive': 0.9385232329368591, 'negative': 0.001975770341232419, 'neutral': 0.05950094759464264}","{'positive': 0.3664090931415558, 'negative': 0.47036147117614746, 'neutral': 0.16322940587997437}"
"December 22, 2023 05:34 PM IST","Biocon Biologics, Sandoz sign pact to distribute adalimumab biosimilar Humira in Japan","Adalimumab BS for subcutaneous injection is a biosimilar of Humira, offering therapeutic solutions for immune-related diseases such as rheumatoid arthritis, psoriasis vulgaris, ankylosing spondylitis, Crohn's disease and ulcerative colitis",stock_news2,"['Adalimumab BS', 'Humira', 'Crohn']","['Biocon Biologics', 'Sandoz', 'Humira', 'Japan']","{'positive': 0.7134668231010437, 'negative': 0.0807599127292633, 'neutral': 0.2057732790708542}","{'positive': 0.09703327715396881, 'negative': 0.3157089054584503, 'neutral': 0.5872578024864197}"
"December 22, 2023 05:33 PM IST","Innova Captab IPO sees 3.54 times subscription, retail portion booked 5.02 times",Innova Captab IPO?: The contract development and manufacturing organisation for Indian pharmaceutical industry intends to mobilise Rs 570 crore through initial public offering at the upper price band,stock_news2,"['Innova Captab', 'IPO', 'Indian', 'Rs 570']","['Innova Captab', 'IPO', '3.54', '5.02']","{'positive': 0.5382493734359741, 'negative': 0.284297913312912, 'neutral': 0.1774527132511139}","{'positive': 0.7139818072319031, 'negative': 0.094856396317482, 'neutral': 0.19116181135177612}"
"December 22, 2023 04:08 PM IST",Rupee rises 12 paise to settle at 83.15 against US dollar,"The Indian currency, however, remained under pressure due to continuous upward movement in the crude oil price triggered by evolving geopolitical situation and outflow of foreign funds, forex traders said.",stock_news2,['Indian'],"['12', '83.15', 'US']","{'positive': 9.685364784672856e-05, 'negative': 0.9954822063446045, 'neutral': 0.004420994780957699}","{'positive': 0.1459120512008667, 'negative': 0.5055767893791199, 'neutral': 0.3485112190246582}"
"December 22, 2023 04:25 PM IST","Investographer1 runs illegal advisory, uses MS Dhoni’s image to promote brand",It has social media handles and a paid group through which it offer advisory services without Sebi registration,stock_news2,[],['MS Dhoni’s'],"{'positive': 0.6738182902336121, 'negative': 0.19256813824176788, 'neutral': 0.13361360132694244}","{'positive': 0.49993598461151123, 'negative': 0.3603217303752899, 'neutral': 0.13974222540855408}"
"December 22, 2023 04:25 PM IST","Taking Stock: Santa rally on D-Street; Nifty above 21,300, Sensex up 242 pts","For the week, BSE Sensex and Nifty50 down 0.5 percent each.",stock_news2,"['the week', 'BSE Sensex', '0.5 percent']","['Santa', 'Nifty', '21,300', '242']","{'positive': 0.35316839814186096, 'negative': 0.07038112729787827, 'neutral': 0.576450526714325}","{'positive': 0.6098864674568176, 'negative': 0.2514077126979828, 'neutral': 0.13870590925216675}"
"December 22, 2023 04:11 PM IST",Allcargo goes for another restructuring: Here’s how it’s beneficial for shareholders,"Allcargo’s latest round of restructuring could be beneficial for shareholders, but analysts suggest a wait and hold call for the stock",stock_news2,['Allcargo'],['Allcargo'],"{'positive': 0.20596839487552643, 'negative': 0.15623867511749268, 'neutral': 0.6377929449081421}","{'positive': 0.4283004701137543, 'negative': 0.2719615399837494, 'neutral': 0.29973798990249634}"
"December 22, 2023 03:13 PM IST",Copper futures gain on higher demand,"On the Multi Commodity Exchange, copper contracts for delivery in December traded higher by Rs 1.65 or 0.22 per cent at Rs 735.20 per kg in a business turnover of 4,591 lots.",stock_news2,"['the Multi Commodity Exchange', 'December', 'Rs 1.65 or', '0.22 per cent', '4,591']",[],"{'positive': 0.1842292696237564, 'negative': 0.08372374624013901, 'neutral': 0.7320469617843628}","{'positive': 0.5908612608909607, 'negative': 0.31765565276145935, 'neutral': 0.09148308634757996}"
"December 22, 2023 03:43 PM IST","Nifty, Sensex snap 7-week winning run; analysts see concentrated rally in select stocks","Nifty and Sensex are likely to continue their upward trend due to a concentrated rally in select stocks. However, the concern in the market now is the excessive valuations in the mid and small-cap segments",stock_news2,[],"['Sensex', '7-week']","{'positive': 0.5329722762107849, 'negative': 0.45553115010261536, 'neutral': 0.01149657741189003}","{'positive': 0.9071217775344849, 'negative': 0.07961206138134003, 'neutral': 0.013266228139400482}"
"December 23, 2023 08:12 AM IST","Azad Engineering IPO final day | Issue subscribed 80.6 times, HNIs portion booked 87.55 times",Azad Engineering IPO | The trading in equity shares on the bourses will commence with effect from December 28.,stock_news2,"['Azad Engineering', 'IPO', 'December 28']","['Azad Engineering IPO', '80.6', '87.55']","{'positive': 0.839146614074707, 'negative': 0.1475381702184677, 'neutral': 0.013315237127244473}","{'positive': 0.7578423619270325, 'negative': 0.09117715805768967, 'neutral': 0.15098050236701965}"
"December 22, 2023 02:05 PM IST",Pharma stocks rally up to 8% to 52-week highs amid rise in fresh Covid cases,"The pharma industry is one of the few defensive industries and investor interest in it is also rising, as concerns about COVID-19 gain momentum, said Aamar Deo Singh, Senior Vice President, Research, Angel One.",stock_news2,"['one', 'COVID-19', 'Aamar Deo Singh', 'Research', 'Angel One']","['Pharma', 'up to 8%', '52-week', 'Covid']","{'positive': 0.9685555100440979, 'negative': 0.004301481880247593, 'neutral': 0.027142951264977455}","{'positive': 0.8828615546226501, 'negative': 0.0801859200000763, 'neutral': 0.036952413618564606}"
"December 22, 2023 01:50 PM IST",MC Explainer | Backtesting and how to read a backtest report,Backtesting is as an analytical tool used by traders to assess the viability and effectiveness of their trading strategies. It involves testing a strategy with historical market data to evaluate how it would have performed in the past,stock_news2,[],['Explainer'],"{'positive': 0.7239711880683899, 'negative': 0.08598059415817261, 'neutral': 0.19004814326763153}","{'positive': 0.24356697499752045, 'negative': 0.1738421469926834, 'neutral': 0.5825908780097961}"
